Rank,Podcast Title,Publisher,Category,Image URL,Apple URL,Release Date,Summary
49,The Rest Is History - Goalhanger,Goalhanger,History,https://is1-ssl.mzstatic.com/image/thumb/Podcasts221/v4/a6/f4/ce/a6f4ce00-b086-32fa-dab6-a6b0788353f5/mza_9832728578412830393.jpg/170x170bb.png,https://podcasts.apple.com/us/podcast/the-rest-is-history/id1537788786?uo=2,2025-04-30T16:00:00-07:00,"Take a deep dive into History’s biggest moments with Tom Holland & Dominic Sandbrook.

Explore the stories of History’s most brutal rulers, deadly battles, and world-changing events. From the rise and fall of the Roman Empire, the Nazi conquest of Europe, and Hitler’s evil master plan for world domination, to the French Revolution, the sinking of the Titanic, or the Norman Conquest of England in 1066, Tom and Dominic bring the past to life with gripping storytelling and expert analysis, as they unpack the high-drama moments that shaped our world.

The Rest Is History Club: Become a member for exclusive bonus episodes, early access to full series and live show tickets, ad-free listening, our exclusive weekly newsletter, discount book prices on titles mentioned on the show, and our members’ chatroom on Discord. 
Just head to therestishistory.com to sign up, or start a free trial today on Apple Podcasts: apple.co/therestishistory.

For more Goalhanger Podcasts, head to www.goalhanger.com."
50,"Young and Profiting with Hala Taha (Entrepreneurship, Sales, Marketing) - Hala Taha | Entrepreneurship, Sales, Marketing | YAP Media Network","Hala Taha | Entrepreneurship, Sales, Marketing | YAP Media Network",Entrepreneurship,https://is1-ssl.mzstatic.com/image/thumb/Podcasts211/v4/80/c1/bd/80c1bd2c-eac4-bdb6-f8cb-ac980b4ad473/mza_16051863235006465622.jpeg/170x170bb.png,https://podcasts.apple.com/us/podcast/young-and-profiting-with-hala-taha-entrepreneurship/id1368888880?uo=2,2025-04-22T10:44:00-07:00,"Young and Profiting with Hala Taha is the must-listen podcast for anyone who is hardcore into entrepreneurship. Hosted by Hala Taha, a self-made entrepreneur and marketing expert, this top-ranked show features mini-masterclasses with business icons and entrepreneurs like GaryVee, Alex Hormozi, Mel Robbins, Reid Hoffman, Tom Bilyeu and Codie Sanchez. Listen to YAP to profit in all aspects of life - from boosting sales and beating algorithms, to brain hacks and biohacking. Whether you’re launching a startup, scaling your business or simply wanting to expand your sales and marketing skills, each episode delivers actionable advice that WILL help you profit in life. If you want the motivation to level up your entrepreneurship game and work hard - while still prioritizing your mental and physical health - then Listen, Learn and Profit with Young and Profiting Podcast!"
51,The Tucker Carlson Show - Tucker Carlson Network,Tucker Carlson Network,News Commentary,https://is1-ssl.mzstatic.com/image/thumb/Podcasts211/v4/ed/4a/a4/ed4aa47c-dbe6-d055-233c-58d8eef48457/mza_16730401749162715650.jpg/170x170bb.png,https://podcasts.apple.com/us/podcast/the-tucker-carlson-show/id1719657632?uo=2,2025-04-23T11:00:00-07:00,The Tucker Carlson Show is your beacon of free speech and honest reporting in a media landscape dominated by misinformation. The only solution to ending the propaganda spiral is by telling the truth. That's our job. Every day. No matter what.
52,The Ben Shapiro Show - The Daily Wire,The Daily Wire,News,https://is1-ssl.mzstatic.com/image/thumb/Podcasts126/v4/98/cc/80/98cc805a-96a1-722c-c4ab-6f439eab1488/mza_15851251438621717582.jpg/170x170bb.png,https://podcasts.apple.com/us/podcast/the-ben-shapiro-show/id1047335260?uo=2,2025-04-25T08:48:00-07:00,"Tired of the lies? Tired of the spin? Are you ready to hear the hard-hitting truth in comprehensive, conservative, principled fashion? The Ben Shapiro Show brings you all the news you need to know in the most fast moving daily program in America. Ben brutally breaks down the culture and never gives an inch! Monday thru Friday."
53,Guru: Don't Cross Kat - Wondery,Wondery,True Crime,https://is1-ssl.mzstatic.com/image/thumb/Podcasts211/v4/37/7f/78/377f78ca-ae37-f901-6383-96e32540fed0/mza_7992175506077177872.jpeg/170x170bb.png,https://podcasts.apple.com/us/podcast/guru-dont-cross-kat/id1518839824?uo=2,2025-05-01T21:00:00-07:00,"Season 2: 
Kat Torres has the insta-perfect life. She is rich, gorgeous and not ashamed to share it. Her posts about witchcraft and ""alien baths"" draw in over a million followers, all chasing the dream of a lifestyle like hers. But as she gathers more followers around her, the secrets beneath her fame grow darker and more dangerous.
One woman sets out to bring back her best friend who has fallen under the spell of this modern-day guru. And what begins as a search for a missing friend soon puts her on a collision course with Kat.
Based on the hit Brazilian podcast, journalist Chico Felitti uncovers a gripping story of influence, control, and those who dare to fight back.

Season 1:
When we face challenges in life, we seek answers from people we believe can help us. When tragedy strikes an exclusive retreat with a self-help superstar, many people are left to wonder: how far is too far? James Arthur Ray was an Oprah-endorsed self-help teacher who achieved fame, fortune, and influence. But friends and family members of his followers questioned his unorthodox methods, and tried to stop him. From Wondery, the makers of ""Dirty John,"" ""Dr. Death,"" and ""The Shrink Next Door,"" comes a story about the dark side of enlightenment. Hosted by journalist Matt Stroud.
Listen to episodes of Guru: Don't Cross Kat early and ad-free by joining Wondery+ in the Wondery App, Apple Podcasts or Spotify. Start your free trial by visiting wondery.com/links/guru/ now."
54,The Jordan Harbinger Show - Jordan Harbinger,Jordan Harbinger,Education,https://is1-ssl.mzstatic.com/image/thumb/Podcasts211/v4/ce/57/a9/ce57a912-523d-5e81-f461-c71591eb2b4b/mza_855972047978822038.jpeg/170x170bb.png,https://podcasts.apple.com/us/podcast/the-jordan-harbinger-show/id1344999619?uo=2,2025-04-22T00:00:00-07:00,"(Apple's Best of 2018) In-depth conversations with people at the top of their game. Jordan Harbinger unpacks guests' wisdom into practical nuggets you can use to impact your work, life, and relationships. Learn from leaders (Ray Dalio, Simon Sinek, Mark Cuban), entertainers (Moby, Tip ""T.I."" Harris, Dennis Quaid), scientists (Neil deGrasse Tyson, Bill Nye), athletes (Kobe Bryant, Dennis Rodman, Tony Hawk) and an eclectic array of fascinating minds, from art forgers and arms traffickers to spies and psychologists."
55,Khloé in Wonder Land - Khloé Kardashian,Khloé Kardashian,Society & Culture,https://is1-ssl.mzstatic.com/image/thumb/Podcasts211/v4/19/af/b2/19afb21f-5254-b904-5721-c55f4ebfb5ef/mza_4110355585128607279.jpeg/170x170bb.png,https://podcasts.apple.com/us/podcast/khlo%C3%A9-in-wonder-land/id1785985876?uo=2,2025-04-17T00:01:00-07:00,"Join Khloé Kardashian each week for intimate conversations with the people who inspire her the most. Each episode dives deep into relatable and thought-provoking topics, offering a mix of humor, insight, and real-life stories. Whether it’s about navigating life’s challenges, celebrating triumphs, or finding humor in the everyday, this series delivers the kind of real talk that stays with you long after you’ve listened.
New episodes drop every Wednesday on X and Thursdays wherever you get your podcasts. "
56,How to Get a Girlfriend with Connell Barrett - Connell Barrett,Connell Barrett,Relationships,https://is1-ssl.mzstatic.com/image/thumb/Podcasts221/v4/98/77/cb/9877cb3c-75b7-77b7-13d5-4193cb66b393/mza_1973641596317379803.jpg/170x170bb.png,https://podcasts.apple.com/us/podcast/how-to-get-a-girlfriend-with-connell-barrett/id1647200555?uo=2,2025-04-22T01:25:00-07:00,"Yes, you can get a great girlfriend! And dating coach Connell Barrett will show you how to confidently connect with women by being authentic—no creepy pickup moves needed. On the How to Get a Girlfriend Podcast, Connell offers the kinds of tested dating tips he shared in his bestselling book, Dating Sucks but You Don’t, and in his TV appearances (GMA, “Today.”) In his 12 years as a coach, Connell has helped thousands of men in 17 countries find love. No wonder Psychology Today named him “America’s top dating coach for men.” Connell personally faced—and fixed—every common dating problem, from not knowing how to flirt to dating-app struggles to low self-confidence. After meeting his dream girlfriend Jess, Connell now helps nice guys and gentlemen find love by dating with “Radical Authenticity.” Ready to meet your soulmate? Join Connell and his expert guests every week for game-changing advice. Carpe date ’em. Seize the date!"
57,The Binge Cases: Fatal Beauty - Sony Music Entertainment,Sony Music Entertainment,True Crime,https://is1-ssl.mzstatic.com/image/thumb/Podcasts211/v4/0c/d4/22/0cd4227b-8118-2787-7ebe-13eb6b21ed07/mza_13766876872176977151.jpeg/170x170bb.png,https://podcasts.apple.com/us/podcast/the-binge-cases-fatal-beauty/id1525807626?uo=2,2025-05-05T21:00:00-07:00,"This is the story of a femme fatale named Sandra Bridewell who wielded her Southern charm like a weapon. After people close to her died, one after the other, Sandra became known as the Black Widow. Soon, she was on the run, trading aliases, getting new men to fall for her and bankroll her extravagant life. Reporter Cooper Moll investigates her secretive life and why she managed to avoid murder charges for so long. 

Fatal Beauty is the latest series from The Binge - subscribe to listen to all episodes, all at once, ad-free right now. 

From serial killer nurses to psychic scammers – The Binge is your home for true crime stories that pull you in and never let go. 

Follow The Binge Crimes and The Binge Cases to get new stories on the first of the month, every month. 

Hit ‘Subscribe’ at the top of The Binge Crimes  show page on Apple Podcasts or visit GetTheBinge.com. 

The Binge – feed your true crime obsession."
58,Conan O’Brien Needs A Friend - Team Coco & Earwolf,Team Coco & Earwolf,Comedy,https://is1-ssl.mzstatic.com/image/thumb/Podcasts221/v4/3f/c5/4c/3fc54cc4-5f86-130a-7d69-d83519d59c32/mza_4548279274177957433.jpg/170x170bb.png,https://podcasts.apple.com/us/podcast/conan-obrien-needs-a-friend/id1438054347?uo=2,2025-05-07T00:00:00-07:00,"After 25 years at the Late Night desk, Conan realized that the only people at his holiday party are the men and women who work for him. Over the years and despite thousands of interviews, Conan has never made a real and lasting friendship with any of his celebrity guests. So, he started a podcast to do just that. Deeper, unboundedly playful, and free from FCC regulations, Conan O’Brien Needs a Friend is a weekly opportunity for Conan to hang out with the people he enjoys most and perhaps find some real friendship along the way.

Subscribe to SiriusXM Podcasts+ to listen to new episodes of Conan O'Brien Needs a Friend ad-free and a whole week early.
Start a free trial now on Apple Podcasts or by visiting siriusxm.com/podcastsplus."
59,What We Spend - Audacy,Audacy,Personal Journals,https://is1-ssl.mzstatic.com/image/thumb/Podcasts211/v4/7e/9e/af/7e9eaf27-7d19-6953-b077-0316112cea4a/mza_14857691082444852802.jpg/170x170bb.png,https://podcasts.apple.com/us/podcast/what-we-spend/id1806711479?uo=2,2025-04-16T00:00:00-07:00,"Imagine if you could ask someone anything you wanted about their finances. On What We Spend, people from across the country and across the financial spectrum are opening their wallets—and their lives—to tell you everything: what they make, what they want, and—for one week—what they spend.
If you want to be on What We Spend, we’d love to hear from you. 
Write us at: whatwespendpodcast@gmail.com"
60,Bone Valley - Lava for Good Podcasts,Lava for Good Podcasts,True Crime,https://is1-ssl.mzstatic.com/image/thumb/Podcasts211/v4/6a/d7/e8/6ad7e8b7-8d7d-4c5e-bcc6-3c56b857d646/mza_2369260848125747849.jpg/170x170bb.png,https://podcasts.apple.com/us/podcast/bone-valley/id1643974551?uo=2,2025-04-23T00:00:00-07:00,"​​In 1987, 18-year-old Michelle Schofield was found dead in a phosphate pit in Florida. Two years later, her husband Leo was convicted and sentenced to life in prison. Fifteen years later, previously unidentified fingerprints matched Jeremy Scott--a violent teenager who lived nearby. Jeremy has since confessed to Michelle’s murder. 

In this groundbreaking podcast, Bone Valley host Gilbert King uncovers startling new evidence that Jeremy is responsible for a string of murders. King is the author of the Pulitzer Prize-winning book, Devil in the Grove, which led to the exonerations of four innocent men.

Bone Valley is a production of Lava for Good Podcasts in association with Signal Co. No1."
61,Storytime with Kayla Jade - MIK Made,MIK Made,Personal Journals,https://is1-ssl.mzstatic.com/image/thumb/Podcasts211/v4/35/02/43/35024343-f67d-64fc-5168-69c5a14e64ab/mza_8488198217164989079.jpg/170x170bb.png,https://podcasts.apple.com/us/podcast/storytime-with-kayla-jade/id1808322115?uo=2,2025-04-08T22:31:00-07:00,"The internet is no stranger to Kayla Jade’s candid confessions from the world of full-service s-work. Now, she’s ready to share the full story. 
Join Kayla at home for exclusive and uncensored storytimes, vulnerable chats with her inner circle, celebrity interviews and a chance to ask her anything. Nothing is off-limits as she talks about everything from money and mental health to body image and beauty standards.
So get cosy, it’s Storytime. "
62,The Ultimate Human with Gary Brecka - Gary Brecka,Gary Brecka,Health & Fitness,https://is1-ssl.mzstatic.com/image/thumb/Podcasts112/v4/77/d2/97/77d29704-0664-ff38-f86a-f632e68193fd/mza_3899530785853927749.jpg/170x170bb.png,https://podcasts.apple.com/us/podcast/the-ultimate-human-with-gary-brecka/id1709740887?uo=2,2025-04-22T00:30:00-07:00,"Gary Brecka is a Human Biologist, biohacker, researcher, and an anti-aging and longevity expert. His approach to health is simple: ""Aging is the aggressive pursuit of comfort.""
For over 20 years, he worked in the life insurance industry predicting mortality. This meant if he got 5 years of medical records and 5 years of demographic data on you, the team that he was associated with could tell a life insurance company how long you had to live to the month. After years and years of doing this type of research and analysis, he decided he wanted to spend the balance of his lifetime helping people live happier, healthier, longer, more fulfilling lives.
With this mission in mind, he created The Ultimate Human podcast. In this weekly podcast, Gary has exciting conversations with celebrities, athletes, entrepreneurs, and scientists and is thrilled to share their transformative insights with you. What's keeping you from being an ultimate human? Tune in to find out.
For more info on Gary, click here: https://link.me/garybrecka"
63,20/20 - ABC News,ABC News,True Crime,https://is1-ssl.mzstatic.com/image/thumb/Podcasts112/v4/33/04/b9/3304b919-a940-55ce-0cf3-90ade9a12f53/mza_14534535648123220467.jpg/170x170bb.png,https://podcasts.apple.com/us/podcast/20-20/id987967575?uo=2,2025-04-25T00:00:00-07:00,"Unforgettable true crime mysteries, exclusive newsmaker interviews, hard-hitting investigative reports and in-depth coverage of high profile stories. Now listen throughout the week with the official 20/20 After Show, the True Crime Vault, and our spotlight of true crime originals."
64,Giggly Squad - Hannah Berner & Paige DeSorbo,Hannah Berner & Paige DeSorbo,Comedy,https://is1-ssl.mzstatic.com/image/thumb/Podcasts221/v4/b1/0a/29/b10a293d-31bf-0e82-dd54-50452336f4c1/mza_908601013238146456.jpeg/170x170bb.png,https://podcasts.apple.com/us/podcast/giggly-squad/id1536352412?uo=2,2025-04-15T04:35:00-07:00,"Welcome to Giggly Squad. Each week, Hannah Berner and Paige DeSorbo make fun of everything, but most importantly themselves. They discuss pop culture, fashion trends, television, horoscopes, mental health, dating, and expose their personal lives. Also, they can't be managed. Hosted on Acast. See acast.com/privacy for more information."
65,REAL AF with Andy Frisella - Andy Frisella #100to0,Andy Frisella #100to0,Entrepreneurship,https://is1-ssl.mzstatic.com/image/thumb/Podcasts115/v4/55/21/67/55216775-731a-1a0b-6c2a-81923902f058/mza_11706571282358600140.jpeg/170x170bb.png,https://podcasts.apple.com/us/podcast/real-af-with-andy-frisella/id1012570406?uo=2,2025-04-25T02:00:00-07:00,"Entrepreneur Andy Frisella and his guests discuss, debate, and laugh their way through trending topics and hot-button issues. (This is also the home of Andy's other show, the top-ranked MFCEO Project Podcast)"
66,Habits and Hustle - Jen Cohen and Habit Nest,Jen Cohen and Habit Nest,Entrepreneurship,https://is1-ssl.mzstatic.com/image/thumb/Podcasts122/v4/97/2a/70/972a705d-da5b-bff9-ba58-1cfda49a85c5/mza_9741046683816951543.jpeg/170x170bb.png,https://podcasts.apple.com/us/podcast/habits-and-hustle/id1451897026?uo=2,2025-04-25T01:00:00-07:00,"Habits and Hustle helps share the stories, habits, and rituals of people's journeys on living fulfilled lives. Host Jennifer Cohen interviews thought leaders, entrepreneurs, and overall extraordinary people who share their insight and open up about the normally hidden aspects that have made a difference in their success."
67,Candace - Candace Owens,Candace Owens,Politics,https://is1-ssl.mzstatic.com/image/thumb/Podcasts211/v4/d1/b1/5c/d1b15c53-9871-007e-1178-1ce94989578c/mza_9166635793026980772.jpg/170x170bb.png,https://podcasts.apple.com/us/podcast/candace/id1750591415?uo=2,2025-04-24T15:21:00-07:00,This time it's just Candace. Free and unfiltered.
68,The Money Mondays - Dan Fleyshman,Dan Fleyshman,Entrepreneurship,https://is1-ssl.mzstatic.com/image/thumb/Podcasts126/v4/a8/60/49/a860491e-a48a-2016-55c4-5426c7998dc9/mza_12477201885067188723.jpg/170x170bb.png,https://podcasts.apple.com/us/podcast/the-money-mondays/id1664983297?uo=2,2025-04-21T08:46:00-07:00,"“The Money Mondays” is primed to be a global brand in the business space, focusing on investments, cash flowing businesses, side hustles and visual acts of charity. Viewers will be able to learn from experts, win weekly prizes and participate in charity efforts in an “MTV Cribs” style setting.

Many episodes of the podcast will be recorded with Celebrities, influencers & athletes inside of their homes, studios & headquarters. 

Hosted by Dan Fleyshman, the youngest founder of a publicly traded company. Dan has Angel invested in 43 companies and spoken at over 250 business industry events."
69,THREE - audiochuck,audiochuck,True Crime,https://is1-ssl.mzstatic.com/image/thumb/Podcasts221/v4/dd/78/64/dd7864eb-29cd-aecc-0159-07adb76eb100/mza_5713252224120261429.jpg/170x170bb.png,https://podcasts.apple.com/us/podcast/three/id1728272114?uo=2,2025-04-17T00:00:00-07:00,"For over 30 years, the murder of 23-year-old Dana Ireland haunted the island of Hawai‘i, leaving behind a tangled web of suspicion, betrayal, and unanswered questions. Three men were convicted. The case was closed. Justice was served. Or so everyone thought.

Hosted by Amanda Knox - an exoneree, journalist, public speaker and best-selling author - this Season of THREE takes you deep into a case that was never as simple as it seemed. Through never-before-heard interviews and unwarranted access, we’ll walk you through this notorious crime and how it impacted three families - The Ireland’s, The Schweitzer’s and The Pauline’s all in very different ways. And the shocking discovery that changed everything.

Someone got away with murder. Until now. 

This is THREE Season 2: Murder in Vacationland."
70,3 Takeaways - Lynn Thoman,Lynn Thoman,Management,https://is1-ssl.mzstatic.com/image/thumb/Podcasts211/v4/16/a4/f8/16a4f8dc-bb71-ceaa-a131-d07ebece6512/mza_3298633229048660964.jpg/170x170bb.png,https://podcasts.apple.com/us/podcast/3-takeaways/id1526080983?uo=2,2025-04-14T22:00:00-07:00,"3 Takeaways features insights from the world’s best thinkers, business leaders, writers, politicians, scientists and other newsmakers. Each episode ends with 3 key takeaways to help you understand the world in new ways that can benefit your life and career. Hosted by Lynn Thoman."
71,Creating Confidence with Heather Monahan - Heather Monahan | YAP Media,Heather Monahan | YAP Media,Entrepreneurship,https://is1-ssl.mzstatic.com/image/thumb/Podcasts122/v4/10/5f/b8/105fb8c5-0eff-0d25-a03b-4a704972b6b6/mza_2001570157629856111.jpeg/170x170bb.png,https://podcasts.apple.com/us/podcast/creating-confidence-with-heather-monahan/id1462192400?uo=2,2025-04-23T02:30:00-07:00,"Looking to take your life to the next level? Each week Heather sits down to share with you the techniques and strategies to create your confidence, pursue your dreams and leapfrog the villains you’ll meet along the way. After successfully shattering the glass ceiling in corporate America, Heather is now a best-selling author, professional speaker and entrepreneur. She is currently pulling back the curtain to expose what it takes to get ahead in business and life so you can claim the greatness that you deserve. Find out why USA Today, CNN, and Steve Harvey have all featured her and most recently seen as a guest lecturer at Harvard."
72,"The Home Service Expert Podcast - Tommy Mello: $200 Million Founder|Forbes, Inc., Entrepreneur Columnist","Tommy Mello: $200 Million Founder|Forbes, Inc., Entrepreneur Columnist",Management,https://is1-ssl.mzstatic.com/image/thumb/Podcasts115/v4/1a/82/4c/1a824c56-1ce0-33cc-bdff-774352745fef/mza_4864943317204897254.jpg/170x170bb.png,https://podcasts.apple.com/us/podcast/the-home-service-expert-podcast/id1341478446?uo=2,2025-04-18T06:00:00-07:00,"The Home Service Expert podcast is the No. 1 podcast for ambitious home service entrepreneurs, whether they are in plumbing, HVAC or another niche. In this show, Tommy Mello, a $200M business founder, will talk with the best entrepreneurs and experts in the home service industry and beyond, to share insights that have made them successful: from the newest marketing tools to the best scaling strategies. Previous podcast guests include Terry Nicholson (former national trainer of NYSE-listed home services company), Craig Smith (President of HomeAdvisor, a home services marketplace valued at $2B+), Cameron Herold (former COO of three $100M+ companies), etc."
73,Armchair Expert with Dax Shepard - Armchair Umbrella,Armchair Umbrella,Comedy,https://is1-ssl.mzstatic.com/image/thumb/Podcasts221/v4/16/5a/d8/165ad8ed-f34c-0c98-c555-9f6f5d75973d/mza_17607833123993886181.jpeg/170x170bb.png,https://podcasts.apple.com/us/podcast/armchair-expert-with-dax-shepard/id1345682353?uo=2,2025-04-30T00:00:00-07:00,"Hi, I’m Dax Shepard, and I love talking to people. I am endlessly fascinated by the messiness of being human, and I find people who are vulnerable and honest about their struggles and shortcomings to be incredibly sexy. I invite you to join me as I explore other people’s stories. We will celebrate, above all, the challenges and setbacks that ultimately lead to growth and betterment. What qualifies me for such an endeavor? More than a decade of sobriety, a degree in Anthropology and four years of improv training. I will attempt to discover human “truths” without any laboratory work, clinical trials or data collection. I will be, in the great tradition of 16th-century scientists, an Armchair Expert.
Follow Armchair Expert on the Wondery App or wherever you get your podcasts. Watch new content on YouTube or listen to Armchair Expert early and ad-free by joining Wondery+ in the Wondery App, Apple Podcasts, or Spotify. Start your free trial by visiting wondery.com/links/armchair-expert-with-dax-shepard/ now."
74,The Russell Brunson Show - Russell Brunson | YAP Media,Russell Brunson | YAP Media,Marketing,https://is1-ssl.mzstatic.com/image/thumb/Podcasts221/v4/37/1e/ed/371eed1f-c157-5989-aea4-25e65c61a02c/mza_7783544417505133374.jpeg/170x170bb.png,https://podcasts.apple.com/us/podcast/the-russell-brunson-show/id1315130618?uo=2,2025-04-23T02:00:00-07:00,"Welcome to The Russell Brunson Show, a podcast that breaks free from the marketing ""box"" to explore the ideas, strategies, and stories shaping success in business and life. Building on the foundation of the Marketing Secrets Podcast, this new evolution dives into Russell’s passions and expertise beyond just marketing.
In each episode, Russell shares insights on marketing, selling, personal development, and the lessons he’s learned from studying some of the most important figures in history. It’s a mix of practical strategies, timeless principles, and fascinating stories that will inspire and challenge you to think differently about business and life.
Whether you’re an entrepreneur, creator, or someone striving to make an impact, The Russell Brunson Show is your go-to guide for thinking outside the box, achieving success, and leaving your mark on the world.
Subscribe now to join Russell as he shares his playbook and his passion for growth."
